word,meaning,partOfSpeech,example,example_ja,leapPart,leapNumber,tags
forehead,額，おでこ,名詞,He wiped the sweat from his forehead.,彼は額から汗を拭いた。,Part3,1043,
chin,下あご，あごの先端,名詞,He rested his chin on his hand.,彼は手にあごをのせた。,Part3,1044,
chest,①胸（部)②（大きな木の）箱，密閉容器,名詞,①She felt pain in her chest. ②He keeps tools in a wooden chest.,①彼女は胸に痛みを感じた。 ②彼は木の箱に道具をしまっている。,Part3,1045,
breast,（主に女性の）胸，乳房,名詞,Breast cancer is common in women.,乳がんは女性に多い。,Part3,1046,
lung,肺〈可算〉,名詞,Smoking damages the lungs.,喫煙は肺を傷つける。,Part3,1047,
organ,①臓器，(動植物の)器官 ②(楽器)オルガン（①②ともに<可算>）,名詞,①The heart is a vital organ. ②She plays the organ at church.,①心臓は重要な臓器だ。 ②彼女は教会でオルガンを弾く。,Part3,1048,
vision,①視力，視野 ②未来像 ③未来を見通す力，先見の明,名詞,①She has excellent vision. ②He has a vision for the future. ③She is a leader with great vision.,①彼女は優れた視力を持っている。 ②彼は未来への未来像を持っている。 ③彼女は先見の明のある指導者だ。,Part3,1049,
skeleton,骸骨，骨格,名詞,The skeleton was found in the cave.,骨格が洞窟で発見された。,Part3,1050,
sensation,①感覚 ②（説明し難い）感情,名詞,①She felt a warm sensation on her skin. ②He had a sensation of falling.,①彼女は肌に温かい感覚を感じた。 ②彼は落ちるような感情を感じた。,Part3,1051,
code,①（服装などの）規定 ②暗号,名詞,①The school has a strict dress code. ②The message was written in code.,①学校には厳格な服装規定がある。 ②そのメッセージは暗号で書かれていた。,Part3,1052,
agenda,議題，協議事項,名詞,What is on the agenda for today?,今日の議題は何ですか？,Part3,1053,
liberty,自由,名詞,Freedom of speech is a basic liberty.,言論の自由は基本的な自由だ。,Part3,1054,
committee,委員会,名詞,The committee will meet next Monday.,委員会は次の月曜日に開く。,Part3,1055,
humanity,①（集合的に）人類 ②（the ―ies）人文科学 ③人間性,名詞,①We must work for the good of all humanity. ②She studies the humanities. ③He showed great humanity.,①すべての人類の善のために働かなければならない。 ②彼女は人文科学を学んでいる。 ③彼は大きな人間性を示した。,Part3,1056,
mankind,（集合的に）人類,名詞,Science has greatly benefited mankind.,科学は人類に大きな恩恵をもたらした。,Part3,1057,
authority,①権威 ②権力 ③（―ies）当局,名詞,①She is an authority on ancient history. ②He abused his authority. ③Contact the local authorities.,①彼女は古代史の権威だ。 ②彼は権力を濫用した。 ③地元の当局に連絡してください。,Part3,1058,
justice,正義,名詞,Everyone deserves justice.,誰もが正義に値する。,Part3,1059,
insurance,保険〈不可算〉,名詞,Do you have health insurance?,健康保険に加入していますか？,Part3,1060,
hardship,（主に経済的）苦難,名詞,Many families faced financial hardship.,多くの家族が経済的苦難に直面した。,Part3,1061,
poverty,貧困〈不可算〉,名詞,Millions of people live in poverty.,何百万もの人々が貧困の中で生活している。,Part3,1062,
chaos,大混乱，混沌〈不可算〉,名詞,The sudden storm caused chaos on the roads.,突然の嵐が道路に大混乱を引き起こした。,Part3,1063,
isolation,孤立，分離，孤独感,名詞,Loneliness and isolation can harm health.,孤独と孤立は健康を害することがある。,Part3,1064,
region,地域,名詞,This region is famous for its wine.,この地域はワインで有名だ。,Part3,1065,
proof,①証拠，証明〈不可算〉 ②（複合語で）～を防ぐ，～に耐える,名詞,①Do you have proof of your identity? ②This jacket is waterproof.,①身分の証拠を持っていますか？ ②このジャケットは防水だ。,Part3,1066,
warranty,保証,名詞,The TV comes with a two-year warranty.,そのテレビは2年間の保証が付いてくる。,Part3,1067,
principle,①原理，原則 ②主義，信念,名詞,①Respect is an important principle. ②She lives by her principles.,①尊重は重要な原則だ。 ②彼女は自分の主義に従って生きている。,Part3,1068,
origin,起源,名詞,No one knows the origin of this word.,誰もこの単語の起源を知らない。,Part3,1069,
setting,①環境，状況 ②（小説，劇，機械などの）設定，舞台（①②ともに<可算>）,名詞,①She grew up in a rural setting. ②The novel has a medieval setting.,①彼女は田舎の環境で育った。 ②その小説は中世の設定だ。,Part3,1070,
mission,①任務，使命 ②使節団 ③（主にキリスト教の）布教（団）,名詞,①His mission was to deliver the package safely. ②A trade mission visited the country. ③She joined a mission to Africa.,①彼の任務は荷物を安全に届けることだった。 ②貿易使節団がその国を訪問した。 ③彼女はアフリカへの布教団に加わった。,Part3,1071,
project,①計画，企画 ②（予算など）を見積もる ③～を投影する,名詞,"①The team completed the project on time. ②We projected the costs at 500,000 yen. ③He projected the image on the wall.",①チームはプロジェクトを時間通りに完成させた。 ②私たちはコストを50万円と見積もった。 ③彼は画像を壁に投影した。,Part3,1072,
monument,記念碑，遺跡，史跡,名詞,We visited the war monument in the park.,私たちは公園の戦争記念碑を訪れた。,Part3,1073,
revolution,革命,名詞,The French Revolution changed Europe forever.,フランス革命は永遠にヨーロッパを変えた。,Part3,1074,
contract,①契約 ②～を契約する ③（病気）に感染する,名詞,①She signed a contract with the company. ②He contracted to deliver the goods. ③He contracted a rare disease.,①彼女は会社と契約を結んだ。 ②彼は商品を届けることを契約した。 ③彼は珍しい病気に感染した。,Part3,1075,
infrastructure,インフラ、基本的施設,名詞,The country needs to improve its infrastructure.,その国はインフラを改善する必要がある。,Part3,1076,
negotiate,①（with ～）（～と）交渉する ②（交渉の上で，条件など）を取り決める,自動詞,①They negotiated with the union. ②They negotiated a new deal.,①彼らは組合と交渉した。 ②彼らは新しい条件を取り決めた。,Part3,1077,
cooperate,（with ～）（～と）協力する，（in ～）（～を）協力する,自動詞,All members must cooperate to succeed.,成功するためにすべてのメンバーが協力しなければならない。,Part3,1078,
restore,①（治安など）を回復する ②（古い建物，絵など）を修復する,他動詞,①The police restored order. ②Workers restored the old painting.,①警察が秩序を回復した。 ②作業員たちが古い絵画を修復した。,Part3,1079,
found,～を創立する,他動詞,He founded the company 20 years ago.,彼は20年前に会社を創立した。,Part3,1080,
conservative,保守的な,形容詞,He has conservative views on education.,彼は教育に関して保守的な見方を持っている。,Part3,1081,
affair,①（―s）情勢 ②（スキャンダラスな）事件 ③情事，浮気,名詞,①World affairs change quickly. ②The scandal became a major affair. ③He had a secret affair.,①世界の情勢は素早く変わる。 ②スキャンダルは大きな事件になった。 ③彼は秘密の情事を持っていた。,Part3,1082,
agency,①（政府）機関 ②代理店,名詞,①She works for a government agency. ②He owns a travel agency.,①彼女は政府機関で働いている。 ②彼は旅行代理店を経営している。,Part3,1083,
council,議会,名詞,The city council approved the new budget.,市議会が新しい予算を承認した。,Part3,1084,
kingdom,①（the ～ kingdom）～界，社会 ②王国,名詞,①The animal kingdom includes insects. ②He ruled the kingdom for 30 years.,①動物界には昆虫が含まれる。 ②彼は30年間王国を統治した。,Part3,1085,
republic,共和国,名詞,France is a republic.,フランスは共和国だ。,Part3,1086,
empire,帝国,名詞,The Roman Empire lasted for centuries.,ローマ帝国は何世紀もの間続いた。,Part3,1087,
aid,援助，救援物資〈不可算〉,名詞,Doctors brought food and aid to the village.,医師たちは村に食料と援助物資を持ってきた。,Part3,1088,
reform,改革,名詞,The government introduced education reform.,政府は教育改革を導入した。,Part3,1089,
minister,①大臣 ②牧師,名詞,The prime minister gave a speech.,首相がスピーチをした。,Part3,1090,
parliament,議会,名詞,Parliament voted on the new law.,議会が新しい法律に投票した。,Part3,1091,
territory,①領土 ②（動物などの）縄張り，（学問などの）領域,名詞,①The country lost territory in the war. ②Bears defend their territory. ③This is outside my territory.,①その国は戦争で領土を失った。 ②熊は縄張りを守る。 ③これは私の領域の外だ。,Part3,1092,
poll,①（政治関連の）世論調査 ②投票 ③（票）を得る,名詞,①Opinion polls show she is popular. ②Voters went to the polls. ③She polled 60% of the votes.,①世論調査は彼女が人気があることを示している。 ②有権者たちは投票に行った。 ③彼女は投票の60%を得た。,Part3,1093,
fortune,①財産 ②運,名詞,①He made a fortune in real estate. ②Good fortune came his way.,①彼は不動産で財産を作った。 ②幸運が彼のところへやってきた。,Part3,1094,
property,①（主に集合的）財産，資産 ②（物質の）特性 ③（建物を含む）所有地,名詞,①All the property was left to the children. ②Gold has unique properties. ③He owns property in the city.,①すべての財産が子どもたちに残された。 ②金には独特の特性がある。 ③彼は都市に所有地を持っている。,Part3,1095,
fund,①（―s）資金 ②基金 ③～に資金を出す,名詞,①The project ran out of funds. ②They set up a scholarship fund. ③The government funded the research.,①プロジェクトの資金が尽きた。 ②彼らは奨学基金を設立した。 ③政府が研究に資金を出した。,Part3,1096,
stock,①株（式)②在庫品，蓄え,名詞,①She bought stocks in the company. ②The shop ran out of stock.,①彼女はその会社の株を買った。 ②店の在庫品が尽きた。,Part3,1097,
labor,①労働 ②（集合的に）労働者 ③努力，陣痛,名詞,①Manual labor can be tiring. ②Labor relations improved. ③He put great labor into the project.,①肉体労働は疲れることがある。 ②労使関係が改善した。 ③彼はプロジェクトに大きな努力を注いだ。,Part3,1098,
overwork,①働きすぎる ②～を働かせすぎる，酷使する ③過労,自動詞,①He overworked and became ill. ②She overworks her staff. ③He collapsed from overwork.,①働きすぎて彼は病気になった。 ②彼女はスタッフを働かせすぎる。 ③彼は過労で倒れた。,Part3,1099,
firm,①会社 ②（土台，信念などが）固い ③（体が）引き締まった,名詞,①He works for a law firm. ②The foundations are firm. ③She has a firm body from exercise.,①彼は法律事務所で働いている。 ②基礎は固い。 ③彼女は運動で引き締まった体をしている。,Part3,1100,
union,①労働組合 ②合併 ③連邦,名詞,①The union demanded better pay. ②The union of the two companies created a giant. ③The United States is a federal union.,①組合はより良い賃金を要求した。 ②2社の合併が巨大企業を作り出した。 ③アメリカは連邦国家だ。,Part3,1101,
administration,①経営，運営 ②行政 ③政権 （①②は〈不可算〉）,名詞,①Good administration keeps costs low. ②The city administration announced new rules. ③The Biden administration changed the policy.,①良い経営はコストを低く保つ。 ②市の行政が新しい規則を発表した。 ③バイデン政権が政策を変えた。,Part3,1102,
secretary,①秘書 ②（米国の各省の）長官，事務局長,名詞,①She works as a personal secretary. ②He was appointed Secretary of Defense.,①彼女は個人秘書として働いている。 ②彼は国防長官に任命された。,Part3,1103,
editor,（新聞，雑誌などの）編集長，（書籍の）編集者,名詞,The editor changed several paragraphs.,編集者は何段落かを変えた。,Part3,1104,
client,①依頼人 ②（サービス業の）取引先,名詞,The lawyer met with her client.,弁護士は依頼人と会った。,Part3,1105,
recruit,①（団体・組織が）～を新規採用する ②新兵，新人,他動詞,①The company recruited 50 new graduates. ②He joined the army as a recruit.,①会社は50人の新卒を新規採用した。 ②彼は新兵として軍に入った。,Part3,1106,
basis,①基礎，根拠 ②（on a ～ basis）（～を）基準（として）,名詞,①This is the basis of our agreement. ②She works on a part-time basis.,①これが合意の基礎だ。 ②彼女はパートタイムを基準として働いている。,Part3,1107,
element,①（最も重要な）要素，（化学の）元素 ②（the ―s）自然の力，悪天候 ③（an ― of ～）少しの～,名詞,①Trust is an essential element of friendship. ②Gold is a chemical element. ③The hikers faced the elements. ④There is an element of truth in it.,①信頼は友情の重要な要素だ。 ②金は化学元素だ。 ③ハイカーたちは悪天候に直面した。 ④その中に少しの真実がある。,Part3,1108,
constitute,①（主語が複数）～を構成する ②（主語が単数）～である,他動詞,①Seven members constitute the committee. ②This constitutes a violation of the rules.,①7人のメンバーが委員会を構成する。 ②これはルール違反である。,Part3,1109,
unify,～を統一する,他動詞,The leader unified the country.,指導者が国を統一した。,Part3,1110,
combine,①（A with B)（A）を（B と）結びつける，同時に行う ②結びつく,他動詞,①She combined work with study. ②Hydrogen and oxygen combine to form water.,①彼女は仕事と勉強を結びつけた。 ②水素と酸素が結びついて水を形成する。,Part3,1111,
unite,①団結する ②～を団結させる,自動詞,①The nation united against the enemy. ②Music can unite people.,①国は敵に対して団結した。 ②音楽は人々を団結させることができる。,Part3,1112,
link,①関連、つながり ②（A to B）（A）を（Bに）関連づける,名詞,①Is there a link between stress and illness? ②This road links the two cities.,①ストレスと病気の間に関連はありますか？ ②この道路は2つの都市を結んでいる。,Part3,1113,
relevant,関連のある，重要な,形容詞,Please only share relevant information.,関連のある情報のみを共有してください。,Part3,1114,
murder,①殺人 ②（形容詞的に）殺人の ③（計画的に）～を殺す,名詞,①He was accused of murder. ②Someone murdered the king. ③It was a murder mystery.,①彼は殺人で告訴された。 ②誰かが王を殺した。 ③それは殺人の謎だった。,Part3,1115,
arrest,①～を逮捕する ②逮捕，（医学用語）停止,他動詞,①The police arrested the suspect. ②He was held under arrest.,①警察は容疑者を逮捕した。 ②彼は逮捕状態で拘留された。,Part3,1116,
prison,刑務所,名詞,He spent five years in prison.,彼は5年間刑務所で過ごした。,Part3,1117,
vice,①（売春，麻薬などの）犯罪〈不可算〉 ②悪徳 ③副～,名詞,①The city has a serious vice problem. ②Greed is a vice. ③She is the vice president.,①都市には深刻な犯罪問題がある。 ②貪欲は悪徳だ。 ③彼女は副社長だ。,Part3,1118,
witness,①目撃者，証人 ②証言 ③～を目撃する,名詞,①Several witnesses saw the accident. ②She gave her witness in court. ③He witnessed the crash.,①数人の目撃者が事故を見た。 ②彼女は法廷で証言した。 ③彼は衝突を目撃した。,Part3,1119,
bullet,弾丸,名詞,A bullet hit the wall next to him.,弾丸が彼の隣の壁に当たった。,Part3,1120,
sword,剣,名詞,The knight drew his sword.,騎士は剣を抜いた。,Part3,1121,
wound,①傷 ②～を傷つける,名詞,①He had a deep wound on his arm. ②The soldier was wounded in battle.,①彼は腕に深い傷を持っていた。 ②兵士は戦闘で傷つけられた。,Part3,1122,
triumph,①勝利 ②勝利する,名詞,①Our team's triumph surprised everyone. ②She triumphed over all her opponents.,①私たちのチームの勝利はみんなを驚かせた。 ②彼女はすべての対戦相手に勝利した。,Part3,1123,
military,軍事的な,形容詞,The country increased its military budget.,その国は軍事予算を増やした。,Part3,1124,
strategy,戦略,名詞,We need a new marketing strategy.,新しいマーケティング戦略が必要だ。,Part3,1125,
conquer,①（国や地域）を征服する ②（病気や恐怖など）を克服する,他動詞,①He conquered the fear of speaking in public. ②The army conquered the city.,①彼は人前で話す恐怖を克服した。 ②軍隊が都市を征服した。,Part3,1126,
defend,（A from B）（B からA）を守る,他動詞,The dog defended its owner from the attacker.,犬は攻撃者から主人を守った。,Part3,1127,
dominate,～を支配する,他動詞,One team dominated the whole game.,一つのチームが試合全体を支配した。,Part3,1128,
rob,①（銀行など）を襲う ②（A of B）（A）から（B を）奪う,他動詞,①The gang robbed a bank. ②He was robbed of his wallet.,①ギャングが銀行を襲った。 ②彼は財布を奪われた。,Part3,1129,
deprive,（A of B)（A）から（B を）奪う,他動詞,Lack of sleep deprives you of energy.,睡眠不足があなたからエネルギーを奪う。,Part3,1130,
devastate,①（町など）を壊滅させる ②（人）を打ちのめす,他動詞,①The earthquake devastated the town. ②She was devastated by the news.,①地震が町を壊滅させた。 ②彼女はそのニュースに打ちのめされた。,Part3,1131,
crash,①激突する ②（飛行機が）墜落する ③激突，墜落,自動詞,①The car crashed into a tree. ②The plane crashed into the sea. ③There was a loud crash outside.,①車が木に激突した。 ②飛行機が海に墜落した。 ③外で大きな激突音がした。,Part3,1132,
hazard,危険（になり得るもの）<可算>,名詞,Icy roads are a serious hazard.,凍った道路は深刻な危険だ。,Part3,1133,
debris,破片，残骸,名詞,Workers cleared debris after the storm.,作業員たちが嵐の後に残骸を片付けた。,Part3,1134,
orphan,孤児,名詞,The war left many children as orphans.,戦争が多くの子どもたちを孤児にした。,Part3,1135,
slave,①奴隷 ②（to ～）（比喩的に）（～の）奴隷,名詞,①Millions were forced to work as slaves. ②He is a slave to his habits.,①何百万人もが奴隷として働くことを強いられた。 ②彼は習慣の奴隷だ。,Part3,1136,
acquaintance,①知人 ②面識，（ちょっとした）知識,名詞,①She is an acquaintance from work. ②We have a passing acquaintance with the topic.,①彼女は仕事からの知人だ。 ②私たちはそのテーマをちょっとだけ知っている。,Part3,1137,
merchant,商人,名詞,A merchant sold spices at the market.,商人が市場でスパイスを売っていた。,Part3,1138,
resident,①住人，居住者 ②滞在者 ③住んでいる,名詞,Local residents protested the new highway.,地元の住人たちが新しい高速道路に抗議した。,Part3,1139,
crew,①（集合的に）乗組員 ②（取材などの）チーム,名詞,The crew of the ship worked through the night.,船の乗組員は一晩中働いた。,Part3,1140,
chase,①～を追いかける ②追跡,他動詞,①The dog chased the cat. ②The police gave chase.,①犬が猫を追いかけた。 ②警察が追跡した。,Part3,1141,
proceed,①（順を追って）進む ②（to do）（さらに続けて）～する,自動詞,①Please proceed to the next step. ②She proceeded to explain the plan.,①次のステップに進んでください。 ②彼女はさらに続けて計画を説明した。,Part3,1142,
fade,（色，記憶などが）薄れる,自動詞,①The color of her dress faded. ②Memories of that day slowly faded.,①彼女のドレスの色が薄れた。 ②その日の記憶がゆっくり薄れた。,Part3,1143,
dissolve,①溶ける ②～を溶かす ③（議会など）を解散する,自動詞,①Sugar dissolves in water. ②She dissolved the salt in hot water. ③Parliament was dissolved.,①砂糖は水に溶ける。 ②彼女は熱湯に塩を溶かした。 ③議会は解散された。,Part3,1144,
float,①浮かぶ ②～を浮かべる,自動詞,①A leaf floated on the water. ②He floated a paper boat on the river.,①葉が水の上に浮かんだ。 ②彼は川に紙のボートを浮かべた。,Part3,1145,
sink,①沈む ②～を沈める ③（台所の）流し,自動詞,①The ship sank after hitting a rock. ②She sank the boat. ③Please put the dishes in the sink.,①船は岩にぶつかって沈んだ。 ②彼女はボートを沈めた。 ③皿を流しに置いてください。,Part3,1146,
bounce,①（ボールなどが）跳ねる ②（宛先不明で）～を返送する,自動詞,①The ball bounced high. ②The email bounced back.,①ボールは高く跳ねた。 ②メールが返送された。,Part3,1147,
transform,①～を（大幅に）変える ②（大幅に）変形する，変身する,他動詞,①Exercise transformed her body. ②The caterpillar transformed into a butterfly.,①運動が彼女の身体を大幅に変えた。 ②毛虫が蝶に変身した。,Part3,1148,
shift,①（考え方の）転換 ②（勤務の）交替,名詞,①There was a shift in public opinion. ②He works the night shift.,①世論の転換があった。 ②彼は夜の勤務交替で働く。,Part3,1149,
modify,～を修正する,他動詞,She modified the recipe to make it healthier.,彼女はより健康的にするためにレシピを修正した。,Part3,1150,
revise,（制度，予測，論文など）を修正する，改正する,他動詞,He revised his essay before submitting it.,彼はエッセイを提出前に修正した。,Part3,1151,
enhance,～を向上させる,他動詞,Exercise enhances your mood and energy.,運動は気分とエネルギーを向上させる。,Part3,1152,
lower,～を下げる,他動詞,The store lowered its prices.,店が価格を下げた。,Part3,1153,
voyage,航海，船旅,名詞,The voyage across the Atlantic took three weeks.,大西洋を横断する航海は3週間かかった。,Part3,1154,
confirm,①～を確認する ②～を裏付ける,他動詞,①Please confirm your booking. ②The test confirmed the diagnosis.,①予約を確認してください。 ②検査が診断を裏付けた。,Part3,1155,
ensure,～を確実にする,他動詞,Please ensure that all windows are locked.,すべての窓が施錠されていることを確実にしてください。,Part3,1156,
address,①～に取り組む ②～に呼びかける ③演説 ④住所,他動詞,①She addressed the problem directly. ②He addressed the audience. ③She gave a short address. ④Write your address here.,①彼女は問題に直接取り組んだ。 ②彼は聴衆に呼びかけた。 ③彼女は短い演説をした。 ④住所をここに書いてください。,Part3,1157,
approach,①（to ～）（～への）取り組み方，接近 ②～に取り組む，接近する,名詞,①Her approach to teaching is creative. ②She approached the dog slowly.,①彼女の教え方への取り組み方は独創的だ。 ②彼女はゆっくりと犬に近づいた。,Part3,1158,
resolve,①～を解決する ②（to do）（～する）決心をする,他動詞,①He resolved the conflict peacefully. ②She resolved to study harder.,①彼は紛争を平和的に解決した。 ②彼女はもっと一生懸命勉強する決心をした。,Part3,1159,
settle,①（紛争など）を解決する ②～を置く，据える ③定住する ④（on ～）（～を）決める,他動詞,①The two countries settled the dispute. ②She settled the vase on the shelf. ③His family settled here in 1900. ④Let's settle on a date.,①2か国が紛争を解決した。 ②彼女は棚に花瓶を置いた。 ③彼の家族は1900年にここに定住した。 ④日程を決めましょう。,Part3,1160,
enrich,～を豊かにする,他動詞,Reading enriches your mind.,読書は心を豊かにする。,Part3,1161,
