word,meaning,partOfSpeech,example,example_ja,leapPart,leapNumber,tags
interact,（with～）（～と）交流する、相互作用する,自動詞,Students interact with each other in group work.,グループ活動で生徒たちはお互いに交流する。,Part2,502,
contribute,（to ～）①（～に）貢献する ②（～の）一因となる ③（A to B）（A）を（B に）寄付する，提供する,自動詞,①She contributed greatly to the project. ②Stress can contribute to illness. ③He contributed money to the school.,①彼女はプロジェクトに大きく貢献した。 ②ストレスは病気の一因となる。 ③彼は学校にお金を寄付した。,Part2,503,
abolish,～を廃止する,他動詞,The country abolished the death penalty.,その国は死刑を廃止した。,Part2,504,
impose,（A on B）（A）を（B に）課す，押しつける,他動詞,The government imposed a new tax on fuel.,政府は燃料に新しい税を課した。,Part2,505,
access,①利用する権利 ②（場所への）接近方法,名詞,①Everyone should have access to clean water. ②The only access to the village is by boat.,①すべての人がきれいな水を利用できるべきだ。 ②その村への唯一の接近方法はボートだ。,Part2,506,
duty,①義務 ②関税,名詞,①It is our duty to vote. ②You must pay customs duty on this item.,①投票するのは私たちの義務だ。 ②この品物には関税を払わなければならない。,Part2,507,
responsible,①（人が主語）責任がある ②（物が主語）原因となっている,形容詞,①She is responsible for the mistake. ②A virus was responsible for the outbreak.,①彼女はその間違いに責任がある。 ②ウイルスが感染拡大の原因となった。,Part2,508,
policy,①政策 ②方針 ③保険契約，約款,名詞,①The school has a strict no-phone policy. ②He changed his policy on taxes. ③Check the details of your insurance policy.,①学校は厳格な携帯電話禁止の方針を持っている。 ②彼は税金に関する政策を変えた。 ③保険契約の詳細を確認してください。,Part2,509,
elect,～を（選挙で）選ぶ,他動詞,She was elected president of the student council.,彼女は生徒会長に選ばれた。,Part2,510,
industry,①工業 ②（the ～ industry）産業，業界 ③勤勉,名詞,①Heavy industry uses a lot of energy. ②He works in the film industry. ③His industry helped him succeed.,①重工業は多くのエネルギーを使う。 ②彼は映画産業で働いている。 ③彼の勤勉さが成功を助けた。,Part2,511,
income,収入,名詞,His income increased after the promotion.,昇進後、彼の収入は増えた。,Part2,512,
profit,利益，利潤,名詞,The company made a large profit last year.,その会社は昨年大きな利益を上げた。,Part2,513,
tax,税金（〈米〉→〈可算〉 〈英〉→〈不可算〉）,名詞,Everyone must pay income tax.,誰もが所得税を払わなければならない。,Part2,514,
expense,①費用，経費 ②（at the ― of ～）（～を）犠牲（にして）,名詞,①The trip was a big expense. ②He succeeded at the expense of his health.,①その旅行は大きな費用だった。 ②彼は健康を犠牲にして成功した。,Part2,515,
debt,借金,名詞,He worked hard to pay off his debt.,彼は借金を返すために一生懸命働いた。,Part2,516,
deposit,①預金 ②頭金，保証金 ③埋蔵物 、堆積物 ④～を預ける,名詞,①She made a deposit at the bank. ②Pay a deposit to reserve the room. ③Oil deposits were found in the desert. ④Please deposit your bags at the front desk.,①彼女は銀行に預金した。 ②部屋を予約するために頭金を払ってください。 ③砂漠で石油の埋蔵物が見つかった。 ④フロントデスクに荷物を預けてください。,Part2,517,
charge,①料金 ②（主にin ―）責任，管理 ③（against ～）（～に対する）非難，告訴 ④～を請求する ⑤～を告訴する ⑥～を充電する,名詞,"①The charge for parking is 500 yen per hour. ②She is in charge of the project. ③He faces charges of fraud. ④They charged 2,000 yen for the meal. ⑤He was charged with speeding. ⑥Please charge my phone.","①駐車料金は1時間500円だ。 ②彼女はプロジェクトの管理責任を持っている。 ③彼は詐欺の告訴に直面している。 ④食事代として2,000円を請求した。 ⑤彼はスピード違反で告訴された。 ⑥私の電話を充電してください。",Part2,518,
wage,①賃金<可算> ②（闘争，運動など）を行う,名詞,①The minimum wage was raised. ②The union waged a long campaign.,①最低賃金が引き上げられた。 ②組合は長い運動を行った。,Part2,519,
recession,不況，不景気,名詞,Many people lost their jobs during the recession.,不況の間に多くの人が仕事を失った。,Part2,520,
consume,～を消費する,他動詞,This car consumes too much fuel.,この車は燃料を消費しすぎる。,Part2,521,
waste,①～を浪費する ②浪費，無駄 ③廃棄物〈不可算〉,他動詞,①Don't waste water. ②Eating out every day is a waste. ③Nuclear waste is dangerous.,①水を無駄にしないでください。 ②毎日外食するのは無駄だ。 ③核廃棄物は危険だ。,Part2,522,
invest,①（A in B）（A）を（B に）投資する ②（A with B）（A）に（B を）与える,他動詞,①He invested money in stocks. ②She invested all her energy in her work.,①彼は株式にお金を投資した。 ②彼女はすべてのエネルギーを仕事に与えた。,Part2,523,
import,①～を輸入する ②輸入，輸入品,他動詞,①Japan imports a lot of oil. ②The import of fresh fruit is limited.,①日本は多くの石油を輸入する。 ②新鮮な果物の輸入は制限されている。,Part2,524,
financial,財政的な，金銭的な,形容詞,The company is in financial trouble.,その会社は財政的な困難にある。,Part2,525,
hire,①～を（一時的に）雇う ②（金を払って短期間）～を借りる,他動詞,①The store hired three new workers. ②He hired a bicycle for the day.,①その店は3人の新しい労働者を雇った。 ②彼は1日自転車を借りた。,Part2,526,
employ,①（人）を雇う ②（物，事）を用いる,他動詞,①The factory employs 500 people. ②She employed a new method to solve the problem.,①その工場は500人を雇っている。 ②彼女は問題を解決するために新しい方法を用いた。,Part2,527,
resign,①（as ～）（～を）辞職する ②（地位など）を辞める,自動詞,①He resigned as manager. ②She resigned her position.,①彼はマネージャーを辞職した。 ②彼女は地位を辞めた。,Part2,528,
qualify,①（for ～）（～の）資格がある ②（as ～）（～としての）資格を得る ③～に資格を与える,自動詞,①She qualified for the finals. ②He qualified as a nurse. ③Her experience qualifies her for the job.,①彼女は決勝に進む資格を得た。 ②彼は看護師の資格を得た。 ③彼女の経験がその仕事の資格を与える。,Part2,529,
assign,①～を割り当てる ②～を配属する,他動詞,①Each student was assigned a topic. ②She was assigned to the Tokyo office.,①各生徒にテーマが割り当てられた。 ②彼女は東京オフィスに配属された。,Part2,530,
occupation,①職業〈可算〉 ②占有，占領〈不可算〉,名詞,①What is your occupation? ②The occupation of the country lasted for years.,①職業は何ですか？ ②その国の占領は何年も続いた。,Part2,531,
career,①職業 ②経歴,名詞,①She has a successful career in medicine. ②His career includes many great achievements.,①彼女は医学での成功した職業を持っている。 ②彼の経歴には多くの偉大な業績が含まれている。,Part2,532,
profession,①（専門的な）職業 ②（the ―）同業者集団,名詞,①Teaching is a noble profession. ②The legal profession has strict rules.,①教育は崇高な職業だ。 ②法曹の同業者集団には厳格なルールがある。,Part2,533,
unemployment,①失業 ②失業率（＝― rate），失業者数 （①②ともに〈不可算〉）,名詞,Unemployment rose during the pandemic.,パンデミック中に失業率が上昇した。,Part2,534,
document,①書類，資料 ②～を記録する,名詞,①Please sign all the documents. ②The film documents life in the village.,①すべての書類に署名してください。 ②その映画は村の生活を記録している。,Part2,535,
department,①（組織の）部門，課 ②（大学の）学科 ③（米国などの）省,名詞,①She works in the sales department. ②He is in the English department. ③The Department of Education set new rules.,①彼女は営業部で働いている。 ②彼は英語学科にいる。 ③教育省が新しい規則を定めた。,Part2,536,
branch,①支店，支局 ②（学問の）部門 ③枝,名詞,①Our company has branches in many cities. ②Linguistics is a branch of science. ③The branch fell in the storm.,①私たちの会社は多くの都市に支店がある。 ②言語学は科学の一部門だ。 ③嵐で枝が落ちた。,Part2,537,
retail,①小売り〈不可算〉 ②小売りされている,名詞,"①She works in retail. ②This item retails for 1,500 yen.","①彼女は小売業で働いている。 ②この商品は1,500円で小売りされている。",Part2,538,
colleague,（from ～）（～の）同僚,名詞,I had lunch with a colleague from work.,職場の同僚と昼食を食べた。,Part2,539,
system,①制度，組織 ②体系 （①②ともに〈可算〉）,名詞,①Japan has a good healthcare system. ②He created a new system for filing papers.,①日本は良い医療制度を持っている。 ②彼は書類整理の新しい体系を作った。,Part2,540,
structure,構造,名詞,The structure of the old bridge is weak.,その古い橋の構造は弱い。,Part2,541,
architecture,建築（様式）〈不可算〉,名詞,The architecture of this temple is beautiful.,このお寺の建築様式は美しい。,Part2,542,
construction,建設〈不可算〉,名詞,The construction of the new road will take two years.,新しい道路の建設には2年かかるだろう。,Part2,543,
function,①機能 ②機能する,名詞,①The function of the heart is to pump blood. ②The old printer no longer functions.,①心臓の機能は血液を送り出すことだ。 ②古いプリンターはもう機能しない。,Part2,544,
surface,①表面<可算> ②表面化する,名詞,①The surface of the lake was calm. ②New issues surfaced during the meeting.,①湖の表面は穏やかだった。 ②会議の中で新しい問題が表面化した。,Part2,545,
aspect,側面<可算>,名詞,We discussed every aspect of the plan.,私たちは計画のすべての側面について議論した。,Part2,546,
edge,①端 ②（ナイフなどの）刃 ③優位,名詞,①Stand back from the edge of the cliff. ②The knife lost its edge. ③Our team has the edge in speed.,①崖の端から離れてください。 ②そのナイフは刃がなくなった。 ③私たちのチームはスピードで優位だ。,Part2,547,
makeup,①（物の）構成、構造 ②（人の）資質 ③化粧 ④（― exam）追試験,名詞,①The makeup of the team changed. ②His makeup makes him hard to trust. ③She put on makeup before work. ④He passed the makeup exam.,①チームの構成が変わった。 ②彼の資質は信頼しにくくする。 ③彼女は仕事の前に化粧をした。 ④彼は追試験に合格した。,Part2,548,
consist,①（of ～）（～で）構成されている ②（in ～）（～に）ある,自動詞,①Water consists of hydrogen and oxygen. ②Happiness consists in small things.,①水は水素と酸素で構成されている。 ②幸せは小さなことにある。,Part2,549,
compose,①～を構成する，組み立てる ②～を作曲［作文］する ③～を落ち着かせる,他動詞,①The team is composed of ten members. ②She composed a beautiful song. ③He composed himself before speaking.,①そのチームは10人のメンバーで構成されている。 ②彼女は美しい曲を作曲した。 ③彼は話す前に自分を落ち着かせた。,Part2,550,
attach,①～をくっつける，添付する ②～に愛着を持たせる,他動詞,①Attach the file to the email. ②He became deeply attached to his dog.,①メールにファイルを添付してください。 ②彼は犬にとても愛着を持った。,Part2,551,
connect,①～をつなげる ②～を関連づける ③つながる,他動詞,①Connect the cable to the computer. ②The two events are connected. ③The two cities connect by train.,①コンピューターにケーブルをつなげてください。 ②その2つの出来事は関連している。 ③2つの都市は電車でつながっている。,Part2,552,
relate,①（A to B）（A）を（B に）関連づける ②～を（順序立てて）話す ③（to ～）（～に）理解を示す,他動詞,①Can you relate your experience to this topic? ②He related the whole story. ③I can really relate to your problem.,①あなたの経験をこのテーマに関連づけられますか？ ②彼は全部の話を話した。 ③あなたの問題にとても理解を示せる。,Part2,553,
associate,①（A with B）（A）を（B と）関連づける，（A）から（B を）連想する ②（with ～)（～と）付き合う ③同僚，共同経営者,他動詞,①People often associate Japan with sushi. ②He associates with criminals. ③She is a business associate.,①人々はしばしば日本から寿司を連想する。 ②彼は犯罪者と付き合っている。 ③彼女はビジネスの同僚だ。,Part2,554,
stick,①～を貼り付ける ②（舌や脚）を出す ③（to）（主義などを）守る，固執する,他動詞,①Stick the label on the bottle. ②Stick out your tongue. ③Stick to your plan.,①ラベルをビンに貼り付けてください。 ②舌を出してください。 ③計画を守ってください。,Part2,555,
thief,泥棒,名詞,A thief stole her bag on the train.,電車で泥棒が彼女のバッグを盗んだ。,Part2,556,
crime,犯罪,名詞,Stealing is a crime.,盗むことは犯罪だ。,Part2,557,
motive,動機,名詞,What was the motive for the crime?,その犯罪の動機は何でしたか？,Part2,558,
punish,（（人）for ～）（人）を（～の理由で）罰する,他動詞,He was punished for cheating on the exam.,彼は試験でカンニングしたことで罰せられた。,Part2,559,
violate,①（法律など）に違反する ②（権利など）を侵害する,他動詞,①Speeding violates traffic law. ②He violated her privacy.,①スピード違反は交通法に違反する。 ②彼は彼女のプライバシーを侵害した。,Part2,560,
legal,①合法の ②法律の，法的な,形容詞,①Is it legal to park here? ②She works for a legal firm.,①ここに駐車するのは合法ですか？ ②彼女は法律事務所で働いている。,Part2,561,
enemy,①敵<可算> ②（形容詞的に）敵の,名詞,He made enemies by being rude.,無礼であることで彼は敵を作った。,Part2,562,
conflict,①対立，紛争 ②葛藤 ③（with ～）（～と）矛盾する,名詞,①The two countries are in conflict. ②He feels inner conflict. ③Her story conflicts with mine.,①その2か国は紛争中だ。 ②彼は内なる葛藤を感じている。 ③彼女の話は私のものと矛盾する。,Part2,563,
compete,①競争する ②（in ～）（競技などに）参加する,自動詞,She competed in the national swimming contest.,彼女は全国水泳大会に参加した。,Part2,564,
defeat,①（相手）を打ち負かす ②敗北,他動詞,①Our team defeated the rivals. ②They suffered a defeat.,①私たちのチームはライバルを打ち負かした。 ②彼らは敗北を被った。,Part2,565,
victim,犠牲者,名詞,The victims of the flood need our help.,洪水の犠牲者たちは私たちの助けを必要としている。,Part2,566,
obstacle,（to ～）（～に対する）障害〈可算〉,名詞,Fear is a big obstacle to success.,恐怖は成功への大きな障害だ。,Part2,567,
harm,①害〈不可算〉 ②～に害を与える,名詞,①Smoking does great harm to your lungs. ②Chemicals can harm the soil.,①喫煙は肺に大きな害を与える。 ②化学物質は土壌に害を与える。,Part2,568,
invade,①（プライバシーなど）を侵害する ②（国など）に侵入する，～を侵略する,他動詞,①He always invades my privacy. ②Enemy forces invaded the country.,①彼はいつも私のプライバシーを侵害する。 ②敵軍がその国に侵略した。,Part2,569,
endanger,～を危険にさらす,他動詞,Pollution endangers many species.,汚染は多くの種を危険にさらす。,Part2,570,
interrupt,①～を中断する ②～を遮る ③人の話を遮る,他動詞,①Don't interrupt me while I'm speaking. ②The storm interrupted the game. ③It's rude to interrupt.,①話しているときに遮らないでください。 ②嵐がゲームを中断した。 ③人の話を遮るのは失礼だ。,Part2,571,
spoil,①～を台無しにする ②（子ども）を甘やかす,他動詞,①Rain spoiled our picnic. ②His parents spoil him.,①雨がピクニックを台無しにした。 ②彼の両親は彼を甘やかしている。,Part2,572,
spectator,観客〈可算〉,名詞,Thousands of spectators watched the game.,数千人の観客が試合を観戦した。,Part2,573,
relative,①（家族も含めて）親戚 ②相対的な,名詞,①She visited her relatives abroad. ②Success is relative.,①彼女は海外の親戚を訪ねた。 ②成功とは相対的なものだ。,Part2,574,
departure,①出発 ②逸脱,名詞,The departure time is 9:00 a.m.,出発時刻は午前9時だ。,Part2,575,
destination,①目的地 ②（tourist ―）観光地，旅行先（①②ともに<可算>）,名詞,Paris is her dream destination.,パリは彼女の夢の目的地だ。,Part2,576,
transportation,交通機関〈不可算〉,名詞,Public transportation is cheap here.,ここでは公共交通機関が安い。,Part2,577,
vehicle,①（エンジンの付いた）車両 ②（思想，意見の）伝達手段,名詞,Only emergency vehicles may park here.,緊急車両のみここに駐車できる。,Part2,578,
baggage,（旅行時の）手荷物<不可算>,名詞,Please do not leave your baggage unattended.,手荷物を放置しないでください。,Part2,579,
via,①～経由で ②～によって,前置詞,We flew to New York via London.,私たちはロンドン経由でニューヨークへ飛んだ。,Part2,580,
lead,①（to ～）（～に）至る ②（a ～ life）（～な生活）を送る ③（A to do）A に～させる ④鉛，（シャーペンなどの）芯,自動詞,①This path leads to the beach. ②She leads a busy life. ③His advice led me to change my mind. ④Lead is a heavy metal.,①この道は浜辺に至る。 ②彼女は忙しい生活を送っている。 ③彼のアドバイスが私に考えを変えさせた。 ④鉛は重い金属だ。,Part2,581,
rise,①上がる，昇る ②上昇,自動詞,①The sun rises in the east. ②There was a rise in prices.,①太陽は東から昇る。 ②物価の上昇があった。,Part2,582,
flow,①流れる ②流れ,自動詞,①Water flows downhill. ②The flow of traffic was slow.,①水は下り坂を流れる。 ②交通の流れが遅かった。,Part2,583,
burst,①破裂する，爆発する ②（慣用句で）突然～し始める,自動詞,①The balloon burst with a loud pop. ②She burst into tears.,①風船が大きな音で破裂した。 ②彼女は突然泣き始めた。,Part2,584,
melt,①（固体が）溶ける ②～を溶かす,自動詞,①The ice melted in the sun. ②Melt the butter in a pan.,①氷が日差しで溶けた。 ②フライパンでバターを溶かしてください。,Part2,585,
commute,①通勤する ②通勤（距離）,自動詞,She commutes two hours each way to work.,彼女は片道2時間かけて通勤する。,Part2,586,
accompany,①（人が主語）～と一緒に行く ②（物が主語）～に伴う,他動詞,①May I accompany you to the station? ②High inflation is accompanied by low growth.,①駅まで一緒に行っていいですか？ ②高インフレには低成長が伴う。,Part2,587,
emit,（ガス、熱、光など）を排出する,他動詞,Cars emit greenhouse gases.,車は温室効果ガスを排出する。,Part2,588,
progress,①進歩，前進 〈不可算〉 ②進歩する，進む,名詞,①The patient is making good progress. ②The project is progressing well.,①患者は順調に回復している。 ②プロジェクトは順調に進んでいる。,Part2,589,
advance,①進歩，前進 〈可算〉 ②（軍隊などが）前進する，進歩する ③事前の,名詞,①Science has made great advances. ②The soldiers advanced toward the city. ③Buy your tickets in advance.,①科学は大きな進歩を遂げた。 ②兵士たちは都市に向けて前進した。 ③事前にチケットを買ってください。,Part2,590,
deal,①（with～）（～を）扱う ②取り引き,自動詞,①She deals with customer complaints. ②He made a good deal on the car.,①彼女は顧客の苦情を扱っている。 ②彼は車で良い取り引きをした。,Part2,591,
handle,①～を扱う ②（手で）～を扱う，触れる ③取っ手,他動詞,①He handled the crisis calmly. ②Handle the glass with care. ③Turn the handle to open the door.,①彼は危機を落ち着いて扱った。 ②グラスを丁寧に扱ってください。 ③取っ手を回してドアを開けてください。,Part2,592,
treat,①（副詞を伴って）～を扱う ②（病人，病気）を治療する ③（A to B)（A)に（Bを）おごる ④楽しみ,他動詞,①He treats everyone fairly. ②The doctor treated her cold. ③I'll treat you to dinner. ④Going to the theme park was a real treat.,①彼は全員を公平に扱う。 ②医者は彼女の風邪を治療した。 ③夕食をおごります。 ④テーマパークに行くのは本当に楽しみだった。,Part2,593,
clue,（to ～）（～の）手がかり,名詞,The footprint was the only clue to the mystery.,足跡がその謎への唯一の手がかりだった。,Part2,594,
restrict,～を制限する,他動詞,Photography is restricted in this area.,この区域では撮影が制限されている。,Part2,595,
limit,①（数量，範囲）を制限する ②制限,他動詞,①The speed limit here is 40 km/h. ②We must limit our use of plastic.,①ここの速度制限は時速40kmだ。 ②プラスチックの使用を制限しなければならない。,Part2,596,
forbid,～を禁じる,他動詞,Smoking is forbidden in this building.,この建物内での喫煙は禁じられている。,Part2,597,
ban,①禁止〈可算〉 ②～を禁止する,名詞,①There is a ban on mobile phones in class. ②The country banned plastic bags.,①授業中の携帯電話の禁止がある。 ②その国はビニール袋を禁止した。,Part2,598,
refuse,①（to do）～するのを拒む ②～を断る,他動詞,①He refused to answer. ②She refused his offer.,①彼は答えることを拒んだ。 ②彼女は彼の申し出を断った。,Part2,599,
reject,①～を拒絶する ②（人）を拒む、除け者にする,他動詞,①He rejected the idea. ②She felt rejected by her classmates.,①彼はそのアイデアを拒絶した。 ②彼女はクラスメートに除け者にされていると感じた。,Part2,600,
persuade,（A to do）（A）を説得して～させる,他動詞,She persuaded her parents to let her study abroad.,彼女は両親を説得して留学させてもらった。,Part2,601,
convince,①（A of B）（A）に（Bを）確信させる，（A that SV）（A）に（～を）確信させる ②（A to do）（A）を説得して～させる,他動詞,①He convinced me of his honesty. ②She convinced him to try again.,①彼は私に自分の正直さを確信させた。 ②彼女は彼を説得して再挑戦させた。,Part2,602,
inspire,①～を奮起させる，かき立てる ②（作品）に創作のヒントを与える,他動詞,①His story inspired us to keep going. ②Nature inspired her paintings.,①彼の話が私たちに進み続ける気持ちをかき立てた。 ②自然が彼女の絵に創作のヒントを与えた。,Part2,603,
discourage,～のやる気をなくさせる，落胆させる,他動詞,Don't let one failure discourage you.,一度の失敗でやる気をなくさないでください。,Part2,604,
promote,①～を促進する ②（be［get］―d to ～）（～に）出世［昇進］する,他動詞,①The program promotes healthy eating. ②She was promoted to team leader.,①そのプログラムは健康的な食事を促進する。 ②彼女はチームリーダーに昇進した。,Part2,605,
boost,～を促進させる，増大させる,他動詞,Exercise can boost your energy levels.,運動はエネルギーレベルを促進させることができる。,Part2,606,
